[
  {
    "id": "card_001",
    "name": "Lady Aiga",
    "title": "Galma Karogu Zīmētāja",
    "image": "/images/char2.png",
    "power": 5,
    "abilityType": "boost_row_random",
    "abilityValue": 2,
    "abilityText": "Ar vienu tintes vilcienu izdaiļo nejaušu sabiedroto un piešķir tam +2 spēku.",
    "rarity": "rare",
    "tags": ["design", "banner", "art"]
  },
  {
    "id": "card_002",
    "name": "Lord Aleksis",
    "title": "Tirgus Laukuma Bļāvējs",
    "image": "/images/char9.png",
    "power": 6,
    "abilityType": "morale",
    "abilityValue": 1,
    "abilityText": "Ar skaļu slavas runu iedvesmo visus pārējos sabiedrotos uz galda un dod tiem +1.",
    "rarity": "epic",
    "tags": ["ads", "promo", "hype"]
  },
  {
    "id": "card_003",
    "name": "Lady Anete Anna",
    "title": "Pils Kancelejas Sargātāja",
    "image": "/images/char4.png",
    "power": 4,
    "abilityType": "comeback",
    "abilityValue": 3,
    "abilityText": "Kad valstībā valda juceklis un tavs galds atpaliek, viņa ievieš kārtību un iegūst +3 spēku.",
    "rarity": "rare",
    "tags": ["office", "order", "bureau"]
  },
  {
    "id": "card_004",
    "name": "Lady Antra",
    "title": "Karaliskā Gaismas Medniece",
    "image": "/images/char4.png",
    "power": 5,
    "abilityType": "double_if_last_card",
    "abilityValue": 2,
    "abilityText": "Ja izspēlēta kā pēdējā kārts rokā, noķer ideālo kadru un dubulto savu spēku.",
    "rarity": "epic",
    "tags": ["photo", "timing", "light"]
  },
  {
    "id": "card_005",
    "name": "Lord Artūrs",
    "title": "Muižas Virssaimnieks",
    "image": "/images/char9.png",
    "power": 7,
    "abilityType": "slay_strongest",
    "abilityValue": 0,
    "abilityText": "Stāv malā kā vienreizējs bonuss un, uzlikts uz galda, nokauj pretinieka stiprāko kārti.",
    "rarity": "epic",
    "tags": ["house", "master", "bonus"]
  },
  {
    "id": "card_006",
    "name": "Lord Edžiņš",
    "title": "Pagalma Priekšnieks ar Tūkstoš Uzdevumiem",
    "image": "/images/char6.png",
    "power": 6,
    "abilityType": "spy_light",
    "abilityValue": 1,
    "abilityText": "Vienmēr ir pilī un vienmēr zina, kur kas nolikts — izspēlējot, paņem 1 papildu kārti.",
    "rarity": "rare",
    "tags": ["project", "office", "helper"]
  },
  {
    "id": "card_007",
    "name": "Lady Elvita",
    "title": "Reklāmu Alķīmiķe",
    "image": "/images/char2.png",
    "power": 7,
    "abilityType": "finisher",
    "abilityValue": 3,
    "abilityText": "Ja pretinieks jau sakrājis prāvu ļaužu pūli, viņa uzvāra reklāmu eliksīru un iegūst +3 spēku.",
    "rarity": "epic",
    "tags": ["ads", "guru", "alchemy"]
  },
  {
    "id": "card_008",
    "name": "Lady Ieva",
    "title": "Gājienu Koordinatore",
    "image": "/images/char1.png",
    "power": 6,
    "abilityType": "morale",
    "abilityValue": 1,
    "abilityText": "Ar mierīgu balsi sadala darbus, termiņus un likteņus — pārējie sabiedrotie saņem +1.",
    "rarity": "rare",
    "tags": ["project", "leader", "order"]
  },
  {
    "id": "card_009",
    "name": "Lord Jāzeps",
    "title": "Divu Objektīvu Burvis",
    "image": "/images/char10.png",
    "power": 6,
    "abilityType": "boost_self",
    "abilityValue": 2,
    "abilityText": "Ja rokā ir kamera vai vismaz labs garastāvoklis, uzreiz iegūst +2 spēku.",
    "rarity": "rare",
    "tags": ["video", "photo", "creator"]
  },
  {
    "id": "card_010",
    "name": "Lord Kārlis",
    "title": "Mēmu Galma Vezīrs",
    "image": "/images/char7.png",
    "power": 5,
    "abilityType": "boost_row_random",
    "abilityValue": 3,
    "abilityText": "Iemet tik spēcīgu galma joku, ka nejaušs sabiedrotais sāk smieties un saņem +3 spēku.",
    "rarity": "epic",
    "tags": ["manager", "memes", "court"]
  },
  {
    "id": "card_011",
    "name": "Lord Krišjānis",
    "title": "Dzejas Maršals",
    "image": "/images/char8.png",
    "power": 5,
    "abilityType": "comeback",
    "abilityValue": 4,
    "abilityText": "Kad viss iet šķībi, viņš noskaita četrindi un no skumjām uzreiz iegūst +4 spēku.",
    "rarity": "epic",
    "tags": ["manager", "poet", "comeback"]
  },
  {
    "id": "card_012",
    "name": "Lord Kristaps",
    "title": "Dzelzs Teha Virspavēlnieks",
    "image": "/images/char5.png",
    "power": 8,
    "abilityType": "morale",
    "abilityValue": 1,
    "abilityText": "Kad viņš paceļ tehnisko zizli, pārējie sabiedrotie savelkas un saņem +1.",
    "rarity": "legendary",
    "tags": ["tech", "lead", "command"]
  },
  {
    "id": "card_013",
    "name": "Lord Kristjans",
    "title": "Koda Arhiburts",
    "image": "/images/char5.png",
    "power": 7,
    "abilityType": "boost_self",
    "abilityValue": 3,
    "abilityText": "Atver slepeno repozitorija pergamentu un uzreiz pieaudzē sev +3 spēku.",
    "rarity": "epic",
    "tags": ["dev", "guru", "code"]
  },
  {
    "id": "card_014",
    "name": "Lady Loreta",
    "title": "Hroniku Rakstvede",
    "image": "/images/char3.png",
    "power": 4,
    "abilityType": "spy_light",
    "abilityValue": 1,
    "abilityText": "Pieraksta tādu stāstu, ka no arhīva izkrīt vēl 1 papildu kārts.",
    "rarity": "common",
    "tags": ["content", "scribe", "story"]
  },
  {
    "id": "card_015",
    "name": "Lord Mārcis",
    "title": "Mākslas un Mehānisko Prātu Burvju Meistars",
    "image": "/images/char8.png",
    "power": 8,
    "abilityType": "finisher",
    "abilityValue": 4,
    "abilityText": "Ja cīņa jau kļuvusi iespaidīga, viņš piesauc gan mākslu, gan kustību, gan dzelzs prātu un iegūst +4.",
    "rarity": "legendary",
    "tags": ["ai", "design", "motion"]
  },
  {
    "id": "card_016",
    "name": "Lord Māris",
    "title": "Tīmekļa Cietokšņa Arhitekts",
    "image": "/images/char6.png",
    "power": 7,
    "abilityType": "damage_enemy_random",
    "abilityValue": 3,
    "abilityText": "Ar vienu bargu skatienu uz serveri sabojā nejaušai pretinieka kārtij 3 spēku.",
    "rarity": "epic",
    "tags": ["dev", "web", "tech"]
  },
  {
    "id": "card_017",
    "name": "Lady Rasa",
    "title": "Sižetu un Uzdevumu Dāma",
    "image": "/images/char1.png",
    "power": 6,
    "abilityType": "boost_row_random",
    "abilityValue": 2,
    "abilityText": "Saskaņo saturu ar plānu tik veikli, ka nejaušs sabiedrotais iegūst +2 spēku.",
    "rarity": "rare",
    "tags": ["project", "content", "coordination"]
  },
  {
    "id": "card_018",
    "name": "Lady Rianda",
    "title": "Rītu Ziņu Hroniste",
    "image": "/images/char3.png",
    "power": 5,
    "abilityType": "none",
    "abilityValue": 0,
    "abilityText": "Bez īpašas burvestības — vienkārši uzticama hroniste, kas vienmēr atnes saturu laikā.",
    "rarity": "common",
    "tags": ["content", "steady", "scribe"]
  },
  {
    "id": "card_019",
    "name": "Lord Rihards",
    "title": "Sportiskais Attēlu Mednieks",
    "image": "/images/char10.png",
    "power": 6,
    "abilityType": "comeback",
    "abilityValue": 3,
    "abilityText": "Ja tavs galds atpaliek, viņš ieskrien kadrā ar varenu sprintu un saņem +3 spēku.",
    "rarity": "rare",
    "tags": ["video", "photo", "sport"]
  },
  {
    "id": "card_020",
    "name": "Lady Terēze",
    "title": "Pils Leģendu Aušana",
    "image": "/images/char4.png",
    "power": 5,
    "abilityType": "double_if_last_card",
    "abilityValue": 2,
    "abilityText": "Ja viņa ir pēdējā kārts rokā, stāsts kļūst divreiz dižāks un spēks dubultojas.",
    "rarity": "rare",
    "tags": ["content", "story", "finisher"]
  },
  {
    "id": "card_021",
    "name": "Lord Artemijs",
    "title": "Ēnu Dizaina un Dzelzs Prātu Kalējs",
    "image": "/images/char5.png",
    "power": 7,
    "abilityType": "boost_self",
    "abilityValue": 2,
    "abilityText": "No melna audekla izkaļ gan vizu, gan mazu gudro mehānismu un iegūst +2 spēku.",
    "rarity": "epic",
    "tags": ["design", "ai", "creator"]
  },
  {
    "id": "card_022",
    "name": "Lord Zigmunds",
    "title": "Montāžas Torņa Acīgais Meistars",
    "image": "/images/char7.png",
    "power": 6,
    "abilityType": "damage_enemy_random",
    "abilityValue": 2,
    "abilityText": "Ar vienu precīzu griezumu montāžas šķērēs nocērt nejaušai pretinieka kārtij 2 spēku.",
    "rarity": "rare",
    "tags": ["photo", "video", "edit"]
  }
]
